,Title,Document type,Reference Number,Date,Source,Status,Subject,Meeting,Treaty,Website,Filename
1634,Agreement between the European Economic Community and the Government of the Democratic Republic of Madagascar on fishing off Madagascar  Protocol 1 between the European Economic Community and the Government of the Democratic Republic of Madagascar on tuna fishing  Protocol 2 between the European Economic Community and the Government of the Democratic Republic of Madagascar on types of fishing other than those covered by Protocol 1,Bilateral,No Data,"Jan 28, 1986","FAO, FAOLEX; &nbsp;\n        \n         IUCN  (ID: TRE-151710)",No Data,Fisheries,No Data,No Data,No Data,No Data
1635,Agreement No19 of 1986 between Hungary and China on cooperation in the field of phytosanitary quarantine and plant protection,Bilateral,No Data,"Jan 23, 1986","FAO, FAOLEX; &nbsp;\n        \n         IUCN  (ID: TRE-148860)",No Data,Cultivated plants,No Data,No Data,No Data,No Data
1636,Accord de coopxc3xa9ration technique dans le domaine de la pxc3xaache entre le Gouvernement de la Rxc3xa9publique de Djibouti et le Gouvernement Dxc3xa9mocratique de Somalie,Bilateral,No Data,"Jan 22, 1986","FAO, FAOLEX; &nbsp;\n        \n         IUCN  (ID: TRE-151689)",No Data,Fisheries,No Data,No Data,No Data,No Data
1637,Agreement for the Establishment of the Intergovernmental Organization for Marketing Information and Technical Advisory Services for Fishery Products in the Asia and Pacific Region INFOFISH,Multilateral,No Data,"Dec 13, 1985",IUCN  (ID: TRE-001389),No Data,Fisheries,No Data,No Data,www.infofish.org \n          \n             \n             www.fao.org,No Data
1638,Protocol for Sustainable Development of Lake Victoria Basin,Multilateral,No Data,"Dec 12, 1985",IUCN  (ID: TRE-002034),No Data,"Fisheries, Water, Environment gen.",No Data,No Data,No Data,No Data
1639,"Amendment to Paragraph 1, Article XIII of the Convention on the Conservation of the Living Resources of the Southeast Atlantic",Multilateral,No Data,"Dec 12, 1985",IUCN  (ID: TRE-001101),No Data,"Sea, Fisheries",No Data,No Data,www.fao.org,No Data
1640,"Amendment for Articles VIII, XVII, XIX and XXI of the Convention on the Conservation of the Living Resources of the Southeast Atlantic",Multilateral,No Data,"Dec 12, 1985",IUCN  (ID: TRE-000997),No Data,"Sea, Fisheries",No Data,No Data,www.fao.org,No Data
1641,Fishing Agreement between the Government of the Republic of Trinidad and Tobago and the Government of the Republic of Venezuela,Bilateral,No Data,"Nov 26, 1985","FAO, FAOLEX; &nbsp;\n        \n         IUCN  (ID: TRE-151743)",No Data,Fisheries,No Data,No Data,No Data,No Data
1642,Exchange of Notes between France and Tuvalu concerning Provisional Maritime Delimitation between the two Countries,Bilateral,No Data,"Nov 5, 1985","FAO, FAOLEX; &nbsp;\n        \n         IUCN  (ID: TRE-148995)",No Data,Sea,No Data,No Data,No Data,No Data
1643,"Accord de coopxc3xa9ration entre la Rxc3xa9publique populaire du Congo et la Rxc3xa9publique populaire de lAngola en matixc3xa8re de pxc3xaache maritime, 1985",Bilateral,No Data,"Oct 22, 1985","FAO, FAOLEX; &nbsp;\n        \n         IUCN  (ID: TRE-151770)",No Data,Fisheries,No Data,No Data,No Data,No Data
1644,Regulation No63 Uniform Provisions concerning the Approval of Mopeds with regard to Noise,Multilateral,No Data,"Aug 15, 1985",IUCN  (ID: TRE-000832),No Data,Air &amp; atmosphere,No Data,No Data,treaties.un.org,No Data
1645,The South Pacific Nuclear Free Zone Treaty,Multilateral,No Data,"Aug 6, 1985",IUCN  (ID: TRE-000948),No Data,Waste &amp; hazardous substances,No Data,No Data,www.forumsec.org \n          \n             \n             forumsec.org,No Data
1646,Fisheries Off the Coast of the United StatesAgreement between the United States of America and the Polish Peoples Republic,Bilateral,No Data,"Aug 1, 1985","FAO, FAOLEX; &nbsp;\n        \n         IUCN  (ID: TRE-152007)",No Data,Fisheries,No Data,No Data,No Data,No Data
1647,Agreement between the Government of United States of America and the Government of Peoples Republic of China concerning fisheries off the coast of the United States,Bilateral,No Data,"Jul 23, 1985","FAO, FAOLEX; &nbsp;\n        \n         IUCN  (ID: TRE-152001)",No Data,Fisheries,No Data,No Data,No Data,No Data
1648,Agreement of Cooperation between the United States of America and the United Mexican States regarding Pollution of the Environment along the Inland International Boundary by Discharges of Hazardous Substances,Bilateral,No Data,"Jul 19, 1985","FAO, FAOLEX; &nbsp;\n        \n         IUCN  (ID: TRE-149412)",No Data,"Waste &amp; hazardous substances, Environment gen.",No Data,No Data,No Data,No Data
1649,Protocol to amend the Agreement for the Establishment of a Regional Centre on Agrarian Reform and Rural Development of Latin America and the Caribbean,Multilateral,No Data,"Jul 17, 1985",IUCN  (ID: TRE-001663),No Data,Agricultural &amp; rural development,No Data,No Data,www.fao.org,No Data
1650,Acuerdo entre la Repxc3xbablica de Colombia y la Repxc3xbablica Federativa del Brasil sobre sanidad animal en xc3xa1reas de frontera,Bilateral,No Data,"Jul 16, 1985","FAO, FAOLEX; &nbsp;\n        \n         IUCN  (ID: TRE-152892)",No Data,Livestock,No Data,No Data,No Data,No Data
1651,ASEAN Agreement on the Conservation of Nature and Natural Resources,Multilateral,No Data,"Jul 9, 1985",IUCN  (ID: TRE-000820),No Data,"Water, Forestry, Air &amp; atmosphere, Sea, Land &amp; soil, Wild species &amp; ecosystems",No Data,No Data,agreement.asean.org,No Data
1652,Protocol to the 1979 Convention on Longrange Transboundary Air Pollution on the Reduction of Sulphur Emissions or their Transboundary Fluxes by at Least 30 per Cent,Multilateral,No Data,"Jul 8, 1985",IUCN  (ID: TRE-000850),No Data,"Waste &amp; hazardous substances, Air &amp; atmosphere",No Data,No Data,www.unece.org \n          \n             \n             treaties.un.org,No Data
1653,Protocol concerning Cooperation in Combating Marine Pollution in cases of Emergency in the Eastern African Region,Multilateral,No Data,"Jun 21, 1985",IUCN  (ID: TRE-000825),No Data,"Sea, Waste &amp; hazardous substances",No Data,No Data,www.unep.org,No Data
1654,"Convention for the Protection, Management and Development of the Marine and Coastal Environment of the Eastern African Region",Multilateral,No Data,"Jun 21, 1985",IUCN  (ID: TRE-000823),No Data,"Mineral resources, Sea, Water, Wild species &amp; ecosystems, Air &amp; atmosphere",No Data,No Data,www.unep.org,No Data
1655,Protocol concerning Protected Areas and Wild Fauna and Flora in the Eastern African Region,Multilateral,No Data,"Jun 21, 1985",IUCN  (ID: TRE-000821),No Data,"Environment gen., Wild species &amp; ecosystems",No Data,No Data,www.unep.org,No Data
1656,Exchange of Notes constituting an Agreement between Finland and Sweden confirming part of the national frontier between the two States,Bilateral,No Data,"Jun 14, 1985","FAO, FAOLEX; &nbsp;\n        \n         IUCN  (ID: TRE-149121)",No Data,Sea,No Data,No Data,No Data,No Data
1657,"Agreement in the form of an exchange of letters between the European Economic Community, on the one hand, and the Government of Denmark and the Home Government of the Faeroe Islands, on the other hand, concerning salmon fishing in Faroese waters",Multilateral,No Data,"May 2, 1985",IUCN  (ID: TRE-153294),No Data,Fisheries,No Data,No Data,europa.eu,No Data
1658,Convention portant crxc3xa9ation dune commission sousrxc3xa9gionale des pxc3xaaches,Multilateral,No Data,"Mar 29, 1985",IUCN  (ID: TRE-153889),No Data,Fisheries,No Data,No Data,No Data,No Data
1659,Agreement between the Government of Cape Verde and the Republic of Senegal on fisheries sector,Bilateral,No Data,"Mar 29, 1985","FAO, FAOLEX; &nbsp;\n        \n         IUCN  (ID: TRE-152331)",No Data,Fisheries,No Data,No Data,No Data,No Data
1660,Vienna Convention for the Protection of the Ozone Layer,Multilateral,No Data,"Mar 22, 1985",IUCN  (ID: TRE-000829),No Data,"Waste &amp; hazardous substances, Air &amp; atmosphere",No Data,No Data,ozone.unep.org \n          \n             \n             treaties.un.org,No Data
1661,"Acuerdo en materia de pesca marxc3xadtima entre el Gobierno de la Repxc3xbablica de Senegal y el Gobierno de Espaxc3xb1a, hecho en Madrid el 1xc2xba de marzo de 1985",Bilateral,No Data,"Mar 1, 1985","FAO, FAOLEX; &nbsp;\n        \n         IUCN  (ID: TRE-151806)",No Data,Fisheries,No Data,No Data,No Data,No Data
1662,"Agreement between the Government of the Republic of Finland and the Government of the Union of Soviet Socialist Republics regarding the delimitation of the economic zone, the fishing zone and the continental shelf in the gulf of Finland and in the NorthEastern part of the Baltic Sea",Bilateral,No Data,"Feb 5, 1985","FAO, FAOLEX; &nbsp;\n        \n         IUCN  (ID: TRE-149070)",No Data,"Sea, Legal questions",No Data,No Data,No Data,No Data
1663,Treaty between the Government of the United States of America and the Government of Canada concerning Pacific Salmon,Bilateral,No Data,"Jan 28, 1985","FAO, FAOLEX; &nbsp;\n        \n         IUCN  (ID: TRE-152394)",No Data,"Fisheries, Water",No Data,No Data,No Data,No Data
1664,Bilateral Agreement between Jordan and Egypt in sea navigation,Bilateral,No Data,"Jan 9, 1985","FAO, FAOLEX; &nbsp;\n        \n         IUCN  (ID: TRE-150093)",No Data,Sea,No Data,No Data,www.mot.gov.jo,No Data
1665,Third ACPCEE Convention,Multilateral,No Data,"Dec 8, 1984",IUCN  (ID: TRE-000826),No Data,"Wild species &amp; ecosystems, Mineral resources, Fisheries, Environment gen., Energy, Water, Land &amp; soil, Sea",No Data,No Data,www.consilium.europa.eu,No Data
1666,Agreement between the Government of the Union of Soviet Socialist Republics and the Government of Japan on mutual relations in the sphere of coastal fisheries of both countries,Bilateral,No Data,"Dec 7, 1984","FAO, FAOLEX; &nbsp;\n        \n         IUCN  (ID: TRE-149853)",No Data,Fisheries,No Data,No Data,No Data,No Data
1667,Agreement between Sweden and Denmark on the Delimitation of the Continental Shelf and Fishing Zones,Bilateral,No Data,"Nov 9, 1984","FAO, FAOLEX; &nbsp;\n        \n         IUCN  (ID: TRE-149046)",No Data,"Sea, Legal questions",No Data,No Data,No Data,No Data
1668,"Acuerdo entre el Gobierno de la Repxc3xbablica de Angola y el Gobierno del Reino de Espaxc3xb1a, en el dominio de la pesca marxc3xadtima, hecho en Luanda, el 2 de noviembre de 1984 traduccixc3xb3n oficial del texto portuguxc3xa9s",Bilateral,No Data,"Nov 2, 1984","FAO, FAOLEX; &nbsp;\n        \n         IUCN  (ID: TRE-151803)",No Data,Fisheries,No Data,No Data,No Data,No Data
1669,Agreement on animal health between Hungary and Germany signed on 12 October 1984 and its amendment signed on 3 February 1995,Bilateral,No Data,"Oct 12, 1984","FAO, FAOLEX; &nbsp;\n        \n         IUCN  (ID: TRE-152220)",No Data,Livestock,No Data,No Data,No Data,No Data
1670,Fisheries Off the Coast of the United States  Agreement between the United States of America and the European Economic Community,Bilateral,No Data,"Oct 1, 1984","FAO, FAOLEX; &nbsp;\n        \n         IUCN  (ID: TRE-152100)",No Data,Fisheries,No Data,No Data,europa.eu.int,No Data
1671,Protocol to the 1979 Convention on Longrange Transboundary Air Pollution on LongTerm Financing of Cooperative Programme for Monitoring and Evaluation of the Long Range Transmission of Air Pollutants in Europe EMEP,Multilateral,No Data,"Sep 28, 1984",IUCN  (ID: TRE-000827),No Data,"Air &amp; atmosphere, Waste &amp; hazardous substances",No Data,No Data,treaties.un.org,No Data
1672,"Amendments to the Annex of the Protocol of 1978 relating to the International Convention for the Prevention of Pollution from Ships, 1973",Multilateral,No Data,"Sep 7, 1984",IUCN  (ID: TRE-000841),No Data,"Sea, Waste &amp; hazardous substances",No Data,No Data,www.imo.org,No Data
1673,Acuerdo de Pesca entre la Repxc3xbablica de Colombia y Jamaica,Bilateral,No Data,"Aug 30, 1984","FAO, FAOLEX; &nbsp;\n        \n         IUCN  (ID: TRE-152895)",No Data,Fisheries,No Data,No Data,No Data,No Data
1674,"Accord de lutte contre le braconnage entre la Rxc3xa9publique populaire du Benin et la Rxc3xa9publique de HauteVolta, 1984",Bilateral,No Data,"Jul 12, 1984","FAO, FAOLEX; &nbsp;\n        \n         IUCN  (ID: TRE-151785)",No Data,Wild species &amp; ecosystems,No Data,No Data,No Data,No Data
1675,Protocol Relating to Modification of the International Convention for the Conservation of Atlantic Tunas,Multilateral,No Data,"Jul 10, 1984",IUCN  (ID: TRE-000871),No Data,"Fisheries, Sea",No Data,No Data,www.fao.org,No Data
1676,Agreement between the European Economic Community and the Government of the Republic of Equatorial Guinea on fishing off the coast of Equatorial Guinea  Protocol between the European Economic Community and the Government of the Republic of Equatorial Guinea,Bilateral,No Data,"Jun 15, 1984","FAO, FAOLEX; &nbsp;\n        \n         IUCN  (ID: TRE-152562)",No Data,Fisheries,No Data,No Data,europa.eu.int,No Data
1677,Agreement between Austria and Hungary on cooperation in the protection of the environment,Bilateral,No Data,"Jun 7, 1984","FAO, FAOLEX; &nbsp;\n        \n         IUCN  (ID: TRE-151890)",No Data,Environment gen.,No Data,No Data,No Data,No Data
1678,"Acuerdo entre el Gobierno de Espaxc3xb1a y el Gobierno de la Repxc3xbablica de las Seychelles sobre pesca marxc3xadtima, hecho en Victoria, Seychelles, el 1 de junio de 1984 traduccixc3xb3n oficial del texto francxc3xa9s",Bilateral,No Data,"Jun 1, 1984","FAO, FAOLEX; &nbsp;\n        \n         IUCN  (ID: TRE-151800)",No Data,Fisheries,No Data,No Data,No Data,No Data
1679,Protocol to amend the International Convention on Civil Liability for Oil Pollution Damage,Multilateral,No Data,"May 25, 1984",IUCN  (ID: TRE-000839),No Data,"Sea, Waste &amp; hazardous substances",No Data,No Data,www.imo.org,No Data
1680,Protocol to amend the International Convention on the Establishment of an International Fund for Compensation for Oil Pollution Damage,Multilateral,No Data,"May 25, 1984",IUCN  (ID: TRE-000840),No Data,"Sea, Waste &amp; hazardous substances",No Data,No Data,www.iopcfund.org,No Data
1681,"Agreement between the Federal Minister of Food, Agriculture and Forestry of the Federal Republic of Germany and the Minister of Agriculture and Fishery of the Netherlands concerning the cooperation on genetic resources of plants",Bilateral,No Data,"May 12, 1984","FAO, FAOLEX; &nbsp;\n        \n         IUCN  (ID: TRE-152016)",No Data,Cultivated plants,No Data,No Data,No Data,No Data
1682,"Agreement between the Governments of the Republic of Portugal, the Peoples Republic of Mozambique and the Republic of South Africa relative to the Cahora Bassa project done at Cape Town, 2 May 1984",Multilateral,No Data,"May 2, 1984",IUCN  (ID: TRE-153235),No Data,Energy,No Data,No Data,No Data,No Data
1683,"Agreement between the Governments of the Republic of Portugal, the Peoples Republic of Mozambique and the Republic of South Africa relative to the Cahora Bassa project",Multilateral,No Data,"May 2, 1984",IUCN  (ID: TRE-001996),No Data,"Energy, Water",No Data,No Data,No Data,No Data
1684,"Treaty between the United States of America and Canada relating to the Skagit River and Ross Lake, and the Seven Mile Reservoir on the Pend DOreille River",Bilateral,No Data,"Apr 2, 1984","FAO, FAOLEX; &nbsp;\n        \n         IUCN  (ID: TRE-152385)",No Data,Water,No Data,No Data,No Data,No Data
1685,"Agreement on fisheries between the European Economic Community, on the one hand, and the Government of Denmark and the local Government of Greenland, on the other",Bilateral,No Data,"Mar 13, 1984","FAO, FAOLEX; &nbsp;\n        \n         IUCN  (ID: TRE-152547)",No Data,Fisheries,No Data,No Data,europa.eu.int,No Data
1686,"Convention de dxc3xa9limitation maritime entre le Gouvernement de Son Altesse Sxc3xa9rxc3xa9nissime le Prince de Monaco et le Gouvernement de la Rxc3xa9publique franxc3xa7aise, signxc3xa9 xc3xa0 Paris le 16 fevrier 1984",Bilateral,No Data,"Feb 16, 1984","FAO, FAOLEX; &nbsp;\n        \n         IUCN  (ID: TRE-151701)",No Data,"Sea, Legal questions",No Data,No Data,www.un.org,No Data
1687,"Agreement concerning the Cachuela Esperanza hydroelectric plant, supplementary to the Agreement on economic and technical cooperation between the Government of the Federative Republic of Brazil and the Government of the Republic of Bolivia",Bilateral,No Data,"Feb 8, 1984","FAO, FAOLEX; &nbsp;\n        \n         IUCN  (ID: TRE-152289)",No Data,"Energy, Water",No Data,No Data,No Data,No Data
1688,Agreement between the European Economic Community and the Government of the Democratic Republic of Sao Tome and Principe on fishing off Sao Tome and Principe  Protocol between the European Economic Community and the Government of the Democratic Republic of Sao Tome and Principe,Bilateral,No Data,"Feb 1, 1984","FAO, FAOLEX; &nbsp;\n        \n         IUCN  (ID: TRE-152556)",No Data,Fisheries,No Data,No Data,europa.eu.int,No Data
1689,Convention on Maritime Boundaries Between the Government of the United Kingdom of Great Britain and Northern Ireland and the Government of the French Republic,Multilateral,No Data,"Oct 25, 1983",IUCN  (ID: TRE-153195),No Data,Sea,No Data,No Data,No Data,No Data
1690,Protocol amending the European Agreement on the Restriction of the Use of certain Detergents in Washing and Cleaning Products,Multilateral,No Data,"Oct 25, 1983",IUCN  (ID: TRE-000762),No Data,"Waste &amp; hazardous substances, Water",No Data,No Data,www.coe.int,No Data
1691,Regulation No 59 Uniform Provisions concerning the Approval of Replacement Silencing Systems,Multilateral,No Data,"Oct 1, 1983",IUCN  (ID: TRE-000779),No Data,Air &amp; atmosphere,No Data,No Data,www.un.org \n          \n             \n             treaties.un.org,No Data
1692,Agreement for the Establishment of a Centre on Agrarian Reform and Rural Development for the Near East,Multilateral,No Data,"Sep 28, 1983",IUCN  (ID: TRE-001118),No Data,"Food &amp; nutrition, Agricultural &amp; rural development",No Data,No Data,www.cardne.org \n          \n             \n             www.fao.org,No Data
1693,Statutes of the International Centre for Genetic Engineering and Biotechnology,Multilateral,No Data,"Sep 13, 1983",IUCN  (ID: TRE-001279),No Data,Environment gen.,No Data,No Data,www.icgeb.trieste.it \n          \n             \n             treaties.un.org,No Data
1694,Agreement for Cooperation in Dealing with Pollution of the North Sea by Oil and other Harmful Substances,Multilateral,No Data,"Sep 13, 1983",IUCN  (ID: TRE-000791),No Data,"Sea, Waste &amp; hazardous substances",No Data,No Data,www.bonnagreement.org \n          \n             \n             www.auswaertiges-amt.de,No Data
1695,Agreement between the United States of America and the United Mexican States on cooperation for the protection and improvement of the environment in the border area,Bilateral,No Data,"Aug 14, 1983","FAO, FAOLEX; &nbsp;\n        \n         IUCN  (ID: TRE-152322)",No Data,Environment gen.,No Data,No Data,No Data,No Data
1696,Convention entre le gouvernement de la Rxc3xa9publique du Sxc3xa9nxc3xa9gal et le gouvernement de la Rxc3xa9publique Islamique de Mauritanie dans le domaine de la pxc3xaache maritime,Bilateral,No Data,"Aug 11, 1983","FAO, FAOLEX; &nbsp;\n        \n         IUCN  (ID: TRE-151728)",No Data,Fisheries,No Data,No Data,No Data,No Data
1697,Protocol for the Protection of SouthEast Pacific against Pollution from LandBased Sources,Multilateral,No Data,"Jul 22, 1983",IUCN  (ID: TRE-000768),No Data,"Sea, Water",No Data,No Data,cpps.dyndns.info,No Data
1698,Supplementary Protocol to the Agreement on Regional Cooperation in Combating Pollution of the SouthEast Pacific by Hydrocarbons or other Harmful Substances,Multilateral,No Data,"Jul 22, 1983",IUCN  (ID: TRE-000769),No Data,"Sea, Waste &amp; hazardous substances",No Data,No Data,cpps.dyndns.info,No Data
1699,"Agreement on the adhoc sharing of the Teesta Waters between India and Bangladesh reached during the 25th meeting of the IndoBangladesh Joint Rivers Commission held in July, 1983 at Dhaka",Bilateral,No Data,"Jul 20, 1983","FAO, FAOLEX; &nbsp;\n        \n         IUCN  (ID: TRE-152460)",No Data,Water,No Data,No Data,No Data,No Data
1700,"Agreement for Water Resources Exploitation within the Uruguai River and its effluent PepiriGuaxc3xa7u River, between the Government of the Federal Republic of Brazil and the Government of the Republic of Argentina",Bilateral,No Data,"Jun 29, 1983","FAO, FAOLEX; &nbsp;\n        \n         IUCN  (ID: TRE-152622)",No Data,"Energy, Water",No Data,No Data,No Data,No Data
1701,"Agreement between the Government of the Hellenic Republic and the Government of the Hungarian Peoples Republic on cooperation in the field of plant protection and plant quarantine, 1983",Bilateral,No Data,"May 25, 1983","FAO, FAOLEX; &nbsp;\n        \n         IUCN  (ID: TRE-151824)",No Data,Cultivated plants,No Data,No Data,No Data,No Data
1702,Amendment to the Convention on International Trade in Endangered Species of Wild Fauna and Flora Art XXI,Multilateral,No Data,"Apr 30, 1983",IUCN  (ID: TRE-001098),No Data,Wild species &amp; ecosystems,No Data,No Data,www.eda.admin.ch \n          \n             \n             www.cites.org,No Data
1703,Agreement between the Central African States concerning the Creation of a Special Fund for the Conservation of Wild Fauna,Multilateral,No Data,"Apr 16, 1983",IUCN  (ID: TRE-001107),No Data,Wild species &amp; ecosystems,No Data,No Data,cites.org,No Data
1704,Agreement for Cooperation and Consultation between the Central African States for the Conservation of Wild Fauna,Multilateral,No Data,"Apr 16, 1983",IUCN  (ID: TRE-001106),No Data,Wild species &amp; ecosystems,No Data,No Data,No Data,No Data
1705,Convention for the Protection and Development of the Marine Environment of the Wider Caribbean Region,Multilateral,No Data,"Mar 24, 1983",IUCN  (ID: TRE-000763),No Data,"Sea, Wild species &amp; ecosystems, Air &amp; atmosphere, Waste &amp; hazardous substances",No Data,No Data,www.cep.unep.org,No Data
1706,Protocol concerning Cooperation in Combating Oil Spills in the Wider Caribbean Region,Multilateral,No Data,"Mar 24, 1983",IUCN  (ID: TRE-000764),No Data,"Sea, Waste &amp; hazardous substances",No Data,No Data,www.cep.unep.org,No Data
1707,Eastern Pacific Ocean Tuna Fishing Agreement,Multilateral,No Data,"Mar 15, 1983",IUCN  (ID: TRE-000830),No Data,Fisheries,No Data,No Data,No Data,No Data
1708,Eastern Pacific Ocean Tuna Fishing Agreement,Multilateral,No Data,"Mar 14, 1983",IUCN  (ID: TRE-153354),No Data,Fisheries,No Data,No Data,No Data,No Data
1709,"Agreement between the Government of the Republic of South Africa, the Government of the Kingdom of Swaziland and the Government of the Peoples Republic of Mozambique relative to the establishment of a Tripartite Permanent Technical Committee",Multilateral,No Data,"Feb 17, 1983",IUCN  (ID: TRE-153231),No Data,Water,No Data,No Data,No Data,No Data
1710,Agreement between the European Economic Community and the Government of the Revolutionary Peoples Republic of Guinea on fishing off the Guinean Coast  Protocol defining the fishing rights and financial compensation provided for in the Agreement between the European Economic Community and the Revolutionary Peoples Republic of Guinea  Exchange of letters,Bilateral,No Data,"Feb 7, 1983","FAO, FAOLEX; &nbsp;\n        \n         IUCN  (ID: TRE-152541)",No Data,Fisheries,No Data,No Data,europa.eu.int,No Data
1711,Agreement between the Government of the Republic of France and the Government of Fiji relating to the delimitation of their Economic Zone,Bilateral,No Data,"Jan 19, 1983","FAO, FAOLEX; &nbsp;\n        \n         IUCN  (ID: TRE-148702)",No Data,Sea,No Data,No Data,No Data,No Data
1712,Agreement between the Government of Tuvalu and the Deepsea Fisheries Association of the Republic of Korea concerning the licensing of fishing vessels of the Republic of Korea to fish within the Fishery Limits of Tuvalu,Bilateral,No Data,"Dec 14, 1982","FAO, FAOLEX; &nbsp;\n        \n         IUCN  (ID: TRE-151764)",No Data,Fisheries,No Data,No Data,No Data,No Data
1713,United Nations Convention on the Law of the Sea,Multilateral,No Data,"Dec 10, 1982",IUCN  (ID: TRE-000753),No Data,"Legal questions, Sea",No Data,No Data,www.un.org \n          \n             \n             www.un.org \n          \n             \n             treaties.un.org,No Data
1714,"Convention modifiant et complxc3xa9tant la convention additionelle du 16 juillet 1975 xc3xa0 la convention du 4 juillet 1969 entre la Rxc3xa9publique franxc3xa7aise et la Rxc3xa9publique fxc3xa9dxc3xa9rale dAllemagne au sujet de lamxc3xa9nagement du Rhin entre StrasbourgKehl et LauterbourgNeuburgweier, signxc3xa9e xc3xa0 Bonn le 6 dxc3xa9cembre 1982",Bilateral,No Data,"Dec 6, 1982","FAO, FAOLEX; &nbsp;\n        \n         IUCN  (ID: TRE-152442)",No Data,Water,No Data,No Data,No Data,No Data
1715,Protocol to amend the Convention on Wetlands of International Importance especially as Waterfowl Habitat,Multilateral,No Data,"Dec 3, 1982",IUCN  (ID: TRE-000759),No Data,"Land &amp; soil, Wild species &amp; ecosystems",No Data,No Data,www.ramsar.org \n          \n             \n             www.unesco.org,No Data
1716,"Protocol to Amend the Convention on Third Party Liability in the Field of Nuclear Energy of 29th July 1960, as amended by the Additional Protocol of 28th January 1964",Multilateral,No Data,"Nov 16, 1982",IUCN  (ID: TRE-000789),No Data,"Waste &amp; hazardous substances, Energy",No Data,No Data,www.oecd-nea.org,No Data
1717,Amendments to the Convention on Fishing and Conservation of the Living Resources in the Baltic Sea and the Belts,Multilateral,No Data,"Nov 11, 1982",IUCN  (ID: TRE-000767),No Data,Fisheries,No Data,No Data,No Data,No Data
